Feature Selection for Simple Color Histogram Filter based on Retinal Fundus Images for Diabetic Retinopathy Recognition,https://www.tandfonline.com/doi/abs/10.1080/03772063.2020.1844082,"T Vijayan, M Sangeetha, A Kumaravel… - IETE Journal of …, 2020 - Taylor & Francis"
Artificial intelligence/machine learning in respiratory medicine and potential role in asthma and COPD diagnosis,https://www.sciencedirect.com/science/article/pii/S221321982100194X,"A Kaplan, H Cao, JM FitzGerald, N Iannotti… - The Journal of Allergy …, 2021 - Elsevier"
Comparative study of fine-tuning of pre-trained convolutional neural networks for diabetic retinopathy screening,https://ieeexplore.ieee.org/abstract/document/8430269/,"S Mohammadian, A Karsaz… - 2017 24th National and …, 2017 - ieeexplore.ieee.org"
Automated diabetic retinopathy grading using deep convolutional neural network,https://arxiv.org/abs/2004.06334,"SS Chaturvedi, K Gupta, V Ninawe… - arXiv preprint arXiv …, 2020 - arxiv.org"
Artificial intelligence with deep learning technology looks into diabetic retinopathy screening,https://jamanetwork.com/journals/jama/article-abstract/2588762,"TY Wong, NM Bressler - Jama, 2016 - jamanetwork.com"
Presentation of a segmentation method for a diabetic retinopathy patient's fundus region detection using a convolutional neural network,https://www.hindawi.com/journals/cin/2021/7714351/,"A Valizadeh, S Jafarzadeh Ghoushchi… - … Intelligence and …, 2021 - hindawi.com"
Risk of blindness among patients with diabetes and newly diagnosed diabetic retinopathy,https://diabetesjournals.org/care/article-abstract/44/3/748/138555,"CC Wykoff, RN Khurana, QD Nguyen, SP Kelly… - Diabetes …, 2021 - Am Diabetes Assoc"
Hybrid model structure for diabetic retinopathy classification,https://www.hindawi.com/journals/jhe/2020/8840174/,"H Liu, K Yue, S Cheng, C Pan, J Sun… - Journal of Healthcare …, 2020 - hindawi.com"
The Role of Different Retinal Imaging Modalities in Predicting Progression of Diabetic Retinopathy: A Survey,https://www.mdpi.com/1424-8220/22/9/3490,"M Elsharkawy, M Elrazzaz, A Sharafeldeen, M Alhalabi… - Sensors, 2022 - mdpi.com"
An approach to detecting diabetic retinopathy based on integrated shallow convolutional neural networks,https://ieeexplore.ieee.org/abstract/document/9208666/,"W Chen, B Yang, J Li, J Wang - IEEE Access, 2020 - ieeexplore.ieee.org"
EdgeAI: diabetic retinopathy detection in intel architecture,https://ieeexplore.ieee.org/abstract/document/9311036/,"G Mathew, SS Ramachandran… - … on Artificial Intelligence …, 2020 - ieeexplore.ieee.org"
Validation of a diagnostic support system for diabetic retinopathy based on clinical parameters,https://tvst.arvojournals.org/article.aspx?articleid=2772400,"P Romero-Aroca, R Verges-Pujol… - … Vision Science & …, 2021 - tvst.arvojournals.org"
Integration of different fuzzy rule-induction methods to improve the classification of patients with diabetic retinopathy,https://books.google.com/books?hl=en&lr=&id=nvA-DwAAQBAJ&oi=fnd&pg=PA6&dq=artificial+intelligence+and+diabetic+retinopathy+classification+or+diagnosis&ots=nBj1jVhcG3&sig=0SWsDMp5Ue-0DSLGV9Bm7MNq3Kg,"I Aguiló - Recent Advances in Artificial Intelligence Research …, 2017 - books.google.com"
An explainable deep learning ensemble model for robust diagnosis of diabetic retinopathy grading,https://dl.acm.org/doi/abs/10.1145/3469841,"M Shorfuzzaman, MS Hossain… - ACM Transactions on …, 2021 - dl.acm.org"
Clinical validation of an artificial intelligence-based diabetic retinopathy screening tool for a national health system,https://www.nature.com/articles/s41433-020-01366-0,"JT Arenas-Cavalli, I Abarca, M Rojas-Contreras… - Eye, 2022 - nature.com"
Machine learning: applications of artificial intelligence to imaging and diagnosis,https://link.springer.com/article/10.1007/s12551-018-0449-9,"JA Nichols, HW Herbert Chan, MAB Baker - Biophysical reviews, 2019 - Springer"
A novel computer-aided diagnostic system for early detection of diabetic retinopathy using 3D-OCT higher-order spatial appearance model,https://www.mdpi.com/2075-4418/12/2/461,"M Elsharkawy, A Sharafeldeen, A Soliman, F Khalifa… - Diagnostics, 2022 - mdpi.com"
A computational-intelligence-based approach for detection of exudates in diabetic retinopathy images,https://ieeexplore.ieee.org/abstract/document/5156192/,"A Osareh, B Shadgar… - IEEE Transactions on …, 2009 - ieeexplore.ieee.org"
"Applications of Artificial Intelligence for the Detection, Management, and Treatment of Diabetic Retinopathy.",https://www.ncbi.nlm.nih.gov/pmc/articles/PMC8514105/,"M Kalavar, H Al-Khersan, J Sridhar… - International …, 2020 - ncbi.nlm.nih.gov"
Diabetic retinopathy screening using smartphone-based fundus imaging in India,https://www.sciencedirect.com/science/article/pii/S0161642020304632,"MWM Wintergerst, DK Mishra, L Hartmann, P Shah… - Ophthalmology, 2020 - Elsevier"
A smart telemedicine system with deep learning to manage diabetic retinopathy and foot ulcers,https://ieeexplore.ieee.org/abstract/document/8818682/,"I Wijesinghe, C Gamage, I Perera… - 2019 Moratuwa …, 2019 - ieeexplore.ieee.org"
Intelligent detection and applied research on diabetic retinopathy based on the residual attention network,https://onlinelibrary.wiley.com/doi/abs/10.1002/ima.22734,"M Yu, Y Wang - International Journal of Imaging Systems and …, 2022 - Wiley Online Library"
Application of artificial intelligence in targeting retinal diseases,https://www.ingentaconnect.com/content/ben/cdt/2020/00000021/00000012/art00008,"FS Sorrentino, G Jurman, K De Nadai… - Current Drug …, 2020 - ingentaconnect.com"
Diagnostic accuracy of a device for the automated detection of diabetic retinopathy in a primary care setting,https://diabetesjournals.org/care/article-abstract/42/4/651/36147,"FD Verbraak, MD Abramoff, GCF Bausch… - Diabetes …, 2019 - Am Diabetes Assoc"
Classification of fundus images for diabetic retinopathy using artificial neural network,https://ieeexplore.ieee.org/abstract/document/8717479/,"NH Harun, Y Yusof, F Hassan… - 2019 IEEE Jordan …, 2019 - ieeexplore.ieee.org"
Proposed retinal abnormality detection and classification approach: Computer aided detection for diabetic retinopathy by machine learning approaches,https://ieeexplore.ieee.org/abstract/document/7586601/,"V Raman, P Then, P Sumari - 2016 8th IEEE International …, 2016 - ieeexplore.ieee.org"
Simple methods for the lesion detection and severity grading of diabetic retinopathy by image processing and transfer learning,https://www.sciencedirect.com/science/article/pii/S0010482521005898,"A Sugeno, Y Ishikawa, T Ohshima… - Computers in Biology and …, 2021 - Elsevier"
Computerized Diagnosis of Diabetic Retinopathy based on Deep Learning Techniques,https://ieeexplore.ieee.org/abstract/document/9792814/,"BT Monisha, C Divya… - … Artificial Intelligence and …, 2022 - ieeexplore.ieee.org"
Review of retinal cameras for global coverage of diabetic retinopathy screening,https://www.nature.com/articles/s41433-020-01262-7,"R Rajalakshmi, V Prathiba, S Arulmalar, M Usha - Eye, 2021 - nature.com"
Deep learning for automated diabetic retinopathy screening fused with heterogeneous data from EHRs can lead to earlier referral decisions,https://jov.arvojournals.org/article.aspx?articleid=2776605,"MY Hsu, JY Chiou, JT Liu, CM Lee… - … Vision Science & …, 2021 - jov.arvojournals.org"
A comprehensive study of machine learning methods on diabetic retinopathy classification,http://acikerisim.bakircay.edu.tr/xmlui/handle/20.500.14034/279,"ÖF Gürcan, ÖF Beyca, O Doğan - … Intelligence Systems, 2021 - acikerisim.bakircay.edu.tr"
Artificial intelligence–assisted detection of diabetic retinopathy on digital fundus images: concepts and applications in the National Health Service,https://www.sciencedirect.com/science/article/pii/B9780128190432000113,"M Kouroupis, N Korfiatis, J Cornford - Innovation in Health Informatics, 2020 - Elsevier"
A critical review on diagnosis of diabetic retinopathy using machine learning and deep learning,https://link.springer.com/article/10.1007/s11042-022-12642-4,"D Das, SK Biswas, S Bandyopadhyay - Multimedia Tools and Applications, 2022 - Springer"
"Recently updated global diabetic retinopathy screening guidelines: commonalities, differences, and future possibilities",https://www.nature.com/articles/s41433-021-01572-4,"T Das, B Takkar, S Sivaprasad, T Thanksphon… - Eye, 2021 - nature.com"
A (eye): a review of current applications of artificial intelligence and machine learning in ophthalmology,https://journals.lww.com/internat-ophthalmology/Fulltext/2020/06010/A_eye___A_Review_of_Current_Applications_of.6.aspx,"GW Armstrong, AC Lorch - International ophthalmology clinics, 2020 - journals.lww.com"
"Artificial intelligence, the internet of things, and virtual clinics: ophthalmology at the digital translation forefront",https://www.thelancet.com/journals/landig/article/PIIS2589-7500(19)30217-1/fulltext,"DSW Ting, H Lin, P Ruamviboonsuk… - The Lancet Digital …, 2020 - thelancet.com"
Evaluation of an AI system for the detection of diabetic retinopathy from images captured with a handheld portable fundus camera: the MAILOR AI study,https://www.nature.com/articles/s41433-020-0927-8,"TW Rogers, J Gonzalez-Bueno, R Garcia Franco… - Eye, 2021 - nature.com"
Discrimination of Diabetic Retinopathy From Optical Coherence Tomography Angiography Images Using Machine Learning Methods,https://ieeexplore.ieee.org/abstract/document/9344690/,"Z Liu, C Wang, X Cai, H Jiang, J Wang - IEEE access, 2021 - ieeexplore.ieee.org"
Transfer learning based diabetic retinopathy detection with a novel preprocessed layer,https://ieeexplore.ieee.org/abstract/document/9230648/,"MR Islam, MAM Hasan… - 2020 IEEE Region 10 …, 2020 - ieeexplore.ieee.org"
Deep neural networks to predict diabetic retinopathy,https://link.springer.com/article/10.1007/s12652-020-01963-7,"TR Gadekallu, N Khare, S Bhattacharya… - … of Ambient Intelligence …, 2020 - Springer"
Comparison of early diabetic retinopathy staging in asymptomatic patients between autonomous AI-based screening and human-graded ultra-widefield colour …,https://www.nature.com/articles/s41433-021-01912-4,"A Sedova, D Hajdu, F Datlinger, I Steiner, M Neschi… - Eye, 2022 - nature.com"
Performance Analysis of Deep-Neural-Network-Based Automatic Diagnosis of Diabetic Retinopathy,https://www.mdpi.com/1424-8220/22/1/205,"H Tariq, M Rashid, A Javed, E Zafar, SS Alotaibi… - Sensors, 2021 - mdpi.com"
Use of smartphones for detecting diabetic retinopathy: a protocol for a scoping review of diagnostic test accuracy studies,https://bmjopen.bmj.com/content/9/12/e028811.abstract,"CH Tan, WH Quah, CSH Tan, H Smith, LT Car - BMJ open, 2019 - bmjopen.bmj.com"
Development and validation of medical record-based logistic regression and machine learning models to diagnose diabetic retinopathy,https://link.springer.com/article/10.1007/s00417-022-05854-9,"HY Li, L Dong, WD Zhou, HT Wu, RH Zhang… - Graefe's Archive for …, 2022 - Springer"
Updating the staging system for diabetic retinal disease,https://www.aaojournal.org/article/S0161-6420(20)31005-8/abstract,"JK Sun, LP Aiello, MD Abràmoff, DA Antonetti… - …, 2021 - aaojournal.org"
End-to-end diabetic retinopathy grading based on fundus fluorescein angiography images using deep learning,https://link.springer.com/article/10.1007/s00417-021-05503-7,"Z Gao, K Jin, Y Yan, X Liu, Y Shi, Y Ge, X Pan… - Graefe's Archive for …, 2022 - Springer"
An intelligent particle swarm optimization with convolutional neural network for diabetic retinopathy classification model,https://www.ingentaconnect.com/contentone/asp/jmihi/2021/00000011/00000003/art00018,"J Jayanthi, T Jayasankar, N Krishnaraj… - Journal of Medical …, 2021 - ingentaconnect.com"
Automatic analysis of microaneurysms turnover to diagnose the progression of diabetic retinopathy,https://ieeexplore.ieee.org/abstract/document/8295214/,"J Xu, X Zhang, H Chen, J Li, J Zhang, L Shao… - IEEE …, 2018 - ieeexplore.ieee.org"
Artificial intelligence and deep learning in ophthalmology-present and future,https://www.spandidos-publications.com/10.3892/etm.2020.9118,"AD Moraru, D Costin, RL Moraru… - Experimental and …, 2020 - spandidos-publications.com"
Artificial intelligence and ophthalmology,https://www.ncbi.nlm.nih.gov/pmc/articles/PMC7086098/,"K Keskinbora, F Güven - Turkish Journal of Ophthalmology, 2020 - ncbi.nlm.nih.gov"
Algorithms for Diagnosis of Diabetic Retinopathy and Diabetic Macula Edema-A Review,https://link.springer.com/chapter/10.1007/5584_2020_499,"K Suriyasekeran, S Santhanamahalingam… - Diabetes: from Research …, 2020 - Springer"
Automated screening system for diabetic retinopathy,https://ieeexplore.ieee.org/abstract/document/1296409/,"C Sinthanayothin, V Kongbunkiat… - … on Image and …, 2003 - ieeexplore.ieee.org"
Various models for diabetic retinopathy screening that can be applied to India,https://www.ncbi.nlm.nih.gov/pmc/articles/PMC8725090/,"R Rajalakshmi, V Prathiba, PK Rani… - Indian Journal of …, 2021 - ncbi.nlm.nih.gov"
Classification of Diabetic Retinopathy Severity Based on GCA Attention Mechanism,https://ieeexplore.ieee.org/abstract/document/9664550/,"B Yang, T Li, H Xie, Y Liao, YPP Chen - IEEE Access, 2021 - ieeexplore.ieee.org"
"Artificial intelligence in ophthalmology: accuracy, challenges, and clinical application",https://journals.lww.com/apjoo/Fulltext/2019/05000/Artificial_Intelligence_in_Ophthalmology_.2.aspx,"Z Tan, J Scheetz, M He - The Asia-Pacific Journal of …, 2019 - journals.lww.com"
Diabetic retinopathy classification for supervised machine learning algorithms,https://journalretinavitreous.biomedcentral.com/articles/10.1186/s40942-021-00352-2,"LF Nakayama, LZ Ribeiro… - … of Retina and …, 2022 - journalretinavitreous.biomedcentral …"
Impact of hybrid neural network on the early diagnosis of diabetic retinopathy disease from video-oculography signals,https://www.sciencedirect.com/science/article/pii/S0960077918304909,"C Kaya, O Erkaymaz, O Ayar, M Özer - Chaos, Solitons & Fractals, 2018 - Elsevier"
Deep learning based early stage diabetic retinopathy detection using optical coherence tomography,https://www.sciencedirect.com/science/article/pii/S0925231219312172,"X Li, L Shen, M Shen, F Tan, CS Qiu - Neurocomputing, 2019 - Elsevier"
Composite deep neural network with gated-attention mechanism for diabetic retinopathy severity classification,https://link.springer.com/article/10.1007/s12652-020-02727-z,"JD Bodapati, NS Shaik, V Naralasetti - Journal of Ambient Intelligence and …, 2021 - Springer"
Diabetic retinopathy detection through image analysis using deep convolutional neural networks,https://books.google.com/books?hl=en&lr=&id=ihGhDQAAQBAJ&oi=fnd&pg=PA58&dq=artificial+intelligence+and+diabetic+retinopathy+classification+or+diagnosis&ots=4Fxh3uvsu3&sig=7mKDezQAZVg7G9Ga-2r7Q7Cy-dY,"J de La Torre, A Valls, D Puig - Artificial Intelligence Research …, 2016 - books.google.com"
Adaptive machine learning classification for diabetic retinopathy,https://link.springer.com/article/10.1007/s11042-020-09793-7,"L Math, R Fatima - Multimedia Tools and Applications, 2021 - Springer"
Diabetic retinopathy detection using machine learning and texture features,https://ieeexplore.ieee.org/abstract/document/8447809/,"M Chetoui, MA Akhloufi… - 2018 IEEE Canadian …, 2018 - ieeexplore.ieee.org"
Diabetic retinopathy diagnosis based on convolutional neural network,https://arxiv.org/abs/2008.00148,"LAN Muhammed, SH Toman - arXiv preprint arXiv:2008.00148, 2020 - arxiv.org"
Deep learning algorithm predicts diabetic retinopathy progression in individual patients,https://www.nature.com/articles/s41746-019-0172-3,"F Arcadu, F Benmansour, A Maunz, J Willis… - NPJ digital …, 2019 - nature.com"
Artificial intelligence in medical practice: the question to the answer?,https://www.sciencedirect.com/science/article/pii/S0002934317311178,"DD Miller, EW Brown - The American journal of medicine, 2018 - Elsevier"
Artificial intelligence (AI) applications for age-related macular degeneration (AMD) and other retinal dystrophies,https://www.tandfonline.com/doi/abs/10.1080/08820538.2021.1896756,"T Perepelkina, AB Fulton - Seminars in ophthalmology, 2021 - Taylor & Francis"
A new eyenet model for diagnosis of diabetic retinopathy,https://www.tandfonline.com/doi/abs/10.1080/08839514.2013.848751,"R Priya, P Aruna - Applied Artificial Intelligence, 2013 - Taylor & Francis"
Deep transfer learning models for medical diabetic retinopathy detection,https://www.ncbi.nlm.nih.gov/pmc/articles/PMC7085308/,"NEM Khalifa, M Loey, MHN Taha… - Acta Informatica …, 2019 - ncbi.nlm.nih.gov"
Combining Artificial Intelligence and Image Processing for Diagnosing Diabetic Retinopathy in Retinal Fundus Images.,https://www.researchgate.net/profile/Obaida-Al-Hazaimeh-2/publication/364382231_Combining_Artificial_Intelligence_and_Image_Processing_for_Diagnosing_Diabetic_Retinopathy_in_Retinal_Fundus_Images/links/6353d40a8d4484154a23de95/Combining-Artificial-Intelligence-and-Image-Processing-for-Diagnosing-Diabetic-Retinopathy-in-Retinal-Fundus-Images.pdf,"OM Al-hazaimeh, AA Abu-Ein, NM Tahat… - … Journal of Online & …, 2022 - researchgate.net"
Diagnosis of diabetic retinopathy using machine learning algorithms,https://www.academia.edu/download/60504384/IRJET-V6I378220190906-25681-i7alhz.pdf,"M Rajkumar, P Charulatha, PH Bindu… - Int Res J Eng …, 2019 - academia.edu"
Transformed representations for convolutional neural networks in diabetic retinopathy screening,https://www.aaai.org/ocs/index.php/WS/AAAIW14/paper/viewPaper/8754,"G Lim, ML Lee, W Hsu, TY Wong - … Conference on Artificial Intelligence, 2014 - aaai.org"
The challenge of diabetic retinopathy standardization in an ophthalmological dataset,https://www.ncbi.nlm.nih.gov/pmc/articles/PMC8655300/,"LF Nakayama, MB Gonçalves, DA Ferraz… - Journal of Diabetes …, 2021 - ncbi.nlm.nih.gov"
Training of nonophthalmologists in diabetic retinopathy screening,https://www.ncbi.nlm.nih.gov/pmc/articles/PMC8725147/,"PK Rani, B Takkar, T Das - Indian Journal of Ophthalmology, 2021 - ncbi.nlm.nih.gov"
Artificial intelligence for anterior segment diseases: Emerging applications in ophthalmology,https://bjo.bmj.com/content/105/2/158.abstract,"DSJ Ting, VHX Foo, LWY Yang, JT Sia… - British Journal of …, 2021 - bjo.bmj.com"
Fully automated artificial intelligence (AI) pipeline for feature-based segmentation and classification of diabetic retinopathy in fundus photographs,https://iovs.arvojournals.org/article.aspx?articleid=2746677,"F Wang, S Xiao, Y Kihara, T Spaide… - … & Visual Science, 2019 - iovs.arvojournals.org"
The upcoming role of Artificial Intelligence (AI) for retinal and glaucomatous diseases,https://www.sciencedirect.com/science/article/pii/S1888429622000541,"LF Desideri, C Rutigliani, P Corazza, A Nastasi… - Journal of …, 2022 - Elsevier"
Screening for diabetic retinopathy in endocrinology clinics by using handheld cameras and applying artificial intelligence algorithms,https://www.ncbi.nlm.nih.gov/pmc/articles/PMC8090068/,"Z Dvey-Aharon, P Huhtinen - Journal of the Endocrine Society, 2021 - ncbi.nlm.nih.gov"
SUNet: A lesion regularized model for simultaneous diabetic retinopathy and diabetic macular edema grading,https://ieeexplore.ieee.org/abstract/document/9098673/,"Z Tu, S Gao, K Zhou, X Chen, H Fu, Z Gu… - 2020 IEEE 17th …, 2020 - ieeexplore.ieee.org"
Artificial intelligence and radiology: collaboration is key,https://www.jacr.org/article/S1546-1440(18)30001-2/abstract,"HY Paul, FK Hui, DSW Ting - Journal of the American College of Radiology, 2018 - jacr.org"
A deep learning system for detecting diabetic retinopathy across the disease spectrum,https://www.nature.com/articles/s41467-021-23458-5,"L Dai, L Wu, H Li, C Cai, Q Wu, H Kong, R Liu… - Nature …, 2021 - nature.com"
Ophthalmic diagnosis using deep learning with fundus images–a critical review,https://www.sciencedirect.com/science/article/pii/S0933365719305858,"S Sengupta, A Singh, HA Leopold, T Gulati… - Artificial Intelligence in …, 2020 - Elsevier"
Diabetic retinopathy grading by a source-free transfer learning approach,https://www.sciencedirect.com/science/article/pii/S174680942101020X,"C Zhang, T Lei, P Chen - Biomedical Signal Processing and Control, 2022 - Elsevier"
Fundus image classification for diabetic retinopathy using disease severity grading,https://dl.acm.org/doi/abs/10.1145/3326172.3326198,"A Sakaguchi, R Wu, S Kamata - … of the 2019 9th international conference …, 2019 - dl.acm.org"
Identifying diabetic retinopathy from oct images using deep transfer learning with artificial neural networks,https://ieeexplore.ieee.org/abstract/document/8787419/,"KT Islam, S Wijewickrema… - 2019 IEEE 32nd …, 2019 - ieeexplore.ieee.org"
Comparison of various data mining classification techniques in the diagnosis of diabetic retinopathy,http://acta.uni-obuda.hu/Vadloori_Huang_Wu_96.pdf,"S Vadloori, YP Huang, WC Wu - Acta Polytechnica Hungarica, 2019 - acta.uni-obuda.hu"
Untangling computer-aided diagnostic system for screening diabetic retinopathy based on deep learning techniques,https://www.mdpi.com/1424-8220/22/5/1803,"MS Farooq, A Arooj, R Alroobaea, AM Baqasah… - Sensors, 2022 - mdpi.com"
Idrid: Diabetic retinopathy–segmentation and grading challenge,https://www.sciencedirect.com/science/article/pii/S1361841519301033,"P Porwal, S Pachade, M Kokare, G Deshmukh… - Medical image …, 2020 - Elsevier"
Determinants of the implementation of an artificial intelligence-supported device for the screening of diabetic retinopathy in primary care–a qualitative study,https://journals.sagepub.com/doi/abs/10.1177/14604582221112816,"LA Held, L Wewetzer… - Health Informatics …, 2022 - journals.sagepub.com"
Evaluating the Viability of a Smartphone-Based Annotation Tool for Faster and Accurate Image Labelling for Artificial Intelligence in Diabetic Retinopathy,https://www.tandfonline.com/doi/abs/10.2147/OPTH.S289425,"AK Morya, J Gowdar, A Kaushal, N Makwana… - Clinical …, 2021 - Taylor & Francis"
Diabetic Retinopathy Detection from Fundus Images of the Eye Using Hybrid Deep Learning Features,https://www.mdpi.com/1707330,"MM Butt, DNFA Iskandar, SE Abdelhamid, G Latif… - Diagnostics, 2022 - mdpi.com"
Development of a deep-learning-based artificial intelligence tool for differential diagnosis between dry and neovascular age-related macular degeneration,https://www.mdpi.com/703124,"TY Heo, KM Kim, HK Min, SM Gu, JH Kim, J Yun… - Diagnostics, 2020 - mdpi.com"
Extraction of retinal blood vessels and diagnosis of proliferative diabetic retinopathy using extreme learning machine,https://www.ingentaconnect.com/contentone/asp/jmihi/2015/00000005/00000002/art00010,"MP Bala, S Vijayachitra - Journal of Medical Imaging and …, 2015 - ingentaconnect.com"
Detection of diabetic retinopathy based on a convolutional neural network using retinal fundus images,https://link.springer.com/chapter/10.1007/978-3-319-68612-7_72,"G García, J Gallardo, A Mauricio, J López… - … Conference on Artificial …, 2017 - Springer"
Diagnostic performance of deep-learning-based screening methods for diabetic retinopathy in primary care—A meta-analysis,https://journals.plos.org/plosone/article?id=10.1371/journal.pone.0255034,"L Wewetzer, LA Held, J Steinhäuser - Plos one, 2021 - journals.plos.org"
Artificial intelligence-based diagnosis of diabetes mellitus: Combining fundus photography with traditional Chinese medicine diagnostic methodology,https://www.hindawi.com/journals/bmri/2021/5556057/,"Y Xiang, L Shujin, C Hongfang, W Yinping… - BioMed Research …, 2021 - hindawi.com"
Emerging trends and research foci in artificial intelligence for retinal diseases: Bibliometric and visualization study,https://www.jmir.org/2022/6/e37532/,"J Zhao, Y Lu, Y Qian, Y Luo, W Yang - Journal of Medical Internet …, 2022 - jmir.org"
Automated diabetic retinopathy detection based on binocular siamese-like convolutional neural network,https://ieeexplore.ieee.org/abstract/document/8660434/,"X Zeng, H Chen, Y Luo, W Ye - IEEE Access, 2019 - ieeexplore.ieee.org"
Machine learning approach for the identification of diabetes retinopathy and its stages,https://ieeexplore.ieee.org/abstract/document/7456965/,"P Nijalingappa, B Sandeep - 2015 International Conference on …, 2015 - ieeexplore.ieee.org"
An active deep learning method for diabetic retinopathy detection in segmented fundus images using artificial bee colony algorithm,https://link.springer.com/article/10.1007/s10462-022-10231-3,"E Özbay - Artificial Intelligence Review, 2022 - Springer"
The Diagnosis of Diabetic Retinopathy: A Transfer Learning with Support Vector Machine Approach,https://link.springer.com/chapter/10.1007/978-3-030-70917-4_38,"FNM Noor, WH Mohd Isa, IM Khairuddin… - International Conference …, 2020 - Springer"
A systematic comparison of bayesian deep learning robustness in diabetic retinopathy tasks,https://arxiv.org/abs/1912.10481,"A Filos, S Farquhar, AN Gomez, TGJ Rudner… - arXiv preprint arXiv …, 2019 - arxiv.org"
Blood vessel segmentation for diabetic retinopathy,https://iopscience.iop.org/article/10.1088/1742-6596/1921/1/012001/meta,"AT Nair, K Muthuvel, KS Haritha - Journal of Physics: Conference …, 2021 - iopscience.iop.org"
Diabetic retinopathy screening based on CNN,https://ieeexplore.ieee.org/abstract/document/8124433/,"M Andonová, J Pavlovičová, S Kajan… - 2017 International …, 2017 - ieeexplore.ieee.org"
